Local;Data;Horário;ID do Trabalho;Título;Autor(es);Orientador(es);Resumo
FCC - Museu Nacional - Biblioteca Bloco: Andar: Auditório;25 Sep / QUI;10:20 às 12:20h;5468;EVIDÊNCIAS PRELIMINARES DE UM CLIMA ÚMIDO DURANTE O VALANGINIANO−BARREMIANO (CRETÁCEO) NA BACIA DO RECÔNCAVO: ANÁLISE PALINOLÓGICA DA FORMAÇÃO MARACANGALHA;"MARCELO DE ARAUJO CARVALHO; MARIA EDUARDA DA COSTA COELHO; MICHELLE CARDOSO DA SILVA CARDOSO";M.;"Este trabalho apresenta resultados e discussões preliminares sobre as condições paleoclimáticas e paleoambientais da Formação Maracangalha, de idade Valanginiano-Barremiano, correspondente à fase rifte da Bacia do Recôncavo. O principal objetivo é contribuir para a ampliação do conhecimento sobre o clima durante esse intervalo geológico, ainda pouco compreendido na região. Foram preparadas, inicialmente, quatro amostras, processadas segundo o protocolo palinológico padrão e analisadas quantitativamente com a contagem mínima de 200 esporomorfos por lâmina. Os táxons identificados foram agrupados com base em suas afinidades botânicas nos seguintes grupos bioclimáticos: Hidrófitas, Higrófitas, Flora Tropical de Planície (FTP), Flora de Terras Altas (FTA) e Xerófitas. A abundância relativa desses grupos foi analisada, juntamente com o cálculo do índice de diversidade Shannon e da razão entre esporos de samambaias e xerófitas (Fs/X), como indicadores preliminares das condições climáticas e ambientais. O gênero mais abundante é Classopollis (29,1%), pertencente à família extinta Cheirolepidiaceae, seguido por Araucariacites (22,9%), associado à família Araucariaceae. A análise dos grupos bioclimáticos revelou predominância da Flora de Terras Altas (FTA), com média de 44,7%, seguida pelas xerófitas (35,2%), higrófitas (15,2%), Flora Tropical de Planície (FTP) com 4,3% e hidrófitas com apenas 0,7%. A média de diversidade taxonômica foi de H’ = 3,1, enquanto a razão Fs/X resultou em 0,3. Esses indicadores apontam para condições climáticas relativamente mais úmidas durante o Valanginiano-Barremiano, quando comparadas ao auge da aridez observado no Aptiano (Carvalho et al., 2022; Giannerini et al., 2023). Os dados sugerem que, neste intervalo mais antigo da fase rifte, predominavam ambientes com maior disponibilidade hídrica e vegetação adaptada a condições menos áridas. Além disso, a ausência de palinomorfos marinhos reforça a interpretação de que os sedimentos da Formação Maracangalha possuem origem predominantemente lacustre, coerente com o contexto deposicional da fase rifte da Bacia do Recôncavo."
FCC - Museu Nacional - Biblioteca Bloco: Andar: Auditório;25 Sep / QUI;10:20 às 12:20h;5489;NOTHOFAGIDITES COMO INDICADOR PALEOPALINOLÓGICO DO EOCENO MÉDIO DA FORMAÇÃO LA MESETA, ILHA SEYMOUR, ANTÉRTICA;"DIANA ROBERTS LOURENçO BARRETO; GIOVANI MATTE CIOCCARI";MARCELO DE ARAUJO CARVALHO;"Nothofagidites é um gênero que engloba grãos de pólen fósseis de plantas pertencentes à família Nothofagaceae. Sua distribuição abrange registros na América do Sul, Antártica e Oceania. A família Nothofagaceae, atualmente representadas apenas pelo gênero Nothofagus blume, são árvores, ocasionalmente arbustos, e sua distribuição atual está restrita a ambientes úmidos e temperados. A Antártica tem sido apontada como possível centro de origem dessa família. Este estudo tem como objetivo analisar a abundância e diversidade (Shannon H) de Nothofagidites encontrados em 11 amostras da seção LM-1, de 8,6 metros de espessura, composta por intercalações de siltitos e arenitos, aflorante na Ilha Seymour, Antártica. Esta seção é parte da Formação La Meseta, datada do Eoceno médio (Luteciano/Bartoniano) que é um vale inciso depositado num ciclo de transgressão marinha e regressão marinha, de forma sequencial. As amostras foram preparadas para palinologia usando método padrão e posteriormente as lâminas foram analisadas em microscópio. A classificação foi baseada nos grupos morfológicos: Ancestral, Fusca, Brassi e Menziesii que diferem em características dos colpos, contorno do pólen, e a relação entre o comprimento dos colpos e o diâmetro equatorial. O material se mostrou bem preservado possibilitando a identificação das espécies de Nothofagidites. Entre os grãos de pólen registrados no material, os Nothofagidites são os mais abundantes. Foram registrados ao todo 8 espécies de Nothofagidites, com sigla N., sendo três do grupo Fusca: N. rocaensis, N. saraensis e N. waipawaensis; três do grupo Brassi: N. dorotensis, N. fuegiensis e N. nanus; um do grupo Menziesii: N. americanus; e um do grupo Ancestral: N. kaitagataensis. Foram registrados um total de 171 grãos de Nothofagidites, com o pico de maior abundância ocorrendo no nível de 6,6 metros, onde foram encontrados 31 grãos. A espécie N. dorotensis destacou-se como a mais abundante, totalizando 46 grãos. A curva de abundância revela um aumento acentuado a partir do nível de 6,6 metros. Quanto à diversidade, observou-se uma variação de H=0,94 (a 8,6 metros) a 1,84 (a 6,6 metros), e a curva de diversidade indica um aumento gradual em direção ao topo da seção. A literatura aponta para um clima quente durante o Eoceno, especialmente no Eoceno inferior da antártica. A quantidade significativa e a diversidade de Nothofagidites registradas na seção LM-1 sugerem que, durante o Eoceno, a família Nothofagaceae predominava nessa região da Antártica, indicando um clima mais ameno, durante o intervalo estudado. Mais pesquisas serão realizadas para agrupar todos os resultados de cada seção da formação La Meseta, ao todo três seções."
FCC - Museu Nacional - Biblioteca Bloco: Andar: Auditório;25 Sep / QUI;13:30 às 15:30h;801;Alterações decorrentes do incêndio em minerais e mineraloides de sílica: quartzo, calcedônia e opala AUTORES E ORIENTADORES: FABIANO RICHARD LEITE FAULSTICH,GISELE RHIS FIGUEIREDO,JOãO VICTOR FONTES FERNANDES TRABALHO: 802 TITULO: ALTERAÇÕES DE ARGENTITA, PROUSTITA E PIROMORFITA GERADAS PELO INCÊNDIO DO MUSEU NACIONAL;"BEATRIZ DE MEDEIROS CAJUEIRO; FABIANO RICHARD LEITE FAULSTICH";GISELE RHIS FIGUEIREDO;A Coleção de Mineralogia do Museu Nacional era composta por cerca de 7500 peças quando passou pelo incêndio de 2018. A combinação de altas temperaturas e exposição à água (corpo de bombeiros e posteriormente, chuva) desenvolveu um ambiente propício para mudanças físicas e químicas nas amostras da coleção. Ao longo dos últimos anos o material resgatado tem passado por um processo de inventário com o principal objetivo de identificar as amostras e correlacioná-las com seu número de tombo original, pois os lastros de identificação foram todos perdidos. No decorrer deste processo foi possível observar que algumas classes minerais se transformaram devido às altas temperaturas atingidas formando novas fases ou se decompondo parcial ou totalmente. Nesta etapa do projeto foram inventariadas 104 amostras, sendo que grande parte são minerais ou mineraloides de sílica (SiO2), ou seja, quartzo, calcedônia (e suas variedades) e opala. Esses minerais/mineraloides são suscetíveis a mudanças estruturais em resposta a variações de temperatura podendo fornecer informações importantes sobre as condições alcançadas durante o incêndio. Portanto, este trabalho tem como objetivo identificar as alterações ocorridas nestas fases e possivelmente estimar as temperaturas atingidas durante o incêndio. As análises macroscópicas mostraram que o quartzo e a calcedônia apresentaram os mesmos tipos de alterações, principalmente fraturamento e mudanças de cor. Além disso, na calcedônia foi possível observar que amostras bandadas foram parcialmente impregnadas, tornando-se pretas e brancas, enquanto outras tiveram toda a sua cor alterada, para vermelho, bege, preto, branco e cinza. Para a opala, além do fraturamento e mudança de coloração, foi possível observar uma alteração em sua densidade devido à desidratação, assim como elas se tornaram extremamente frágeis e algumas até pulverizaram. Cabe ressaltar que o processo de alteração é heterogêneo e, com exceção da opala, algumas amostras permaneceram inalteradas, apresentando apenas algumas mudanças físicas como pequenas fraturas ou impregnação parcial por fuligem. Como próximas etapas deste trabalho estão previstas análises de microscopia eletrônica de varredura com análises químicas (MEV-EDS), difratometria de raios X (DRX) e espectroscopia Raman. Análises de MEV-EDS serão realizadas para observar a estrutura microscópica das amostras assim como identificar a presença de inclusões, impurezas e/ou impregnações causadas pelo incêndio, enquanto análises de DRX e de espectroscopia Raman serão aplicadas para verificar se ocorrem mudanças estruturais ou o aparecimento de novas fases cristalinas.
FCC - Museu Nacional - Biblioteca Bloco: Andar: Auditório;25 Sep / QUI;13:30 às 15:30h;1591;Caracterização automatizada de minério de manganês (gondito) da sequência metavulcanossedimentar Rio das Mortes, estado de Minas Gerais;"CIRO ALEXANDRE ÁVILA; FELIPE EMERSON ANDRÉ ALVES; MATHEUS LAMAS MACHADO; REINER NEUMANN";RUAN PEREIRA DE MORAES FIGUEIREDO;"Minerais de manganês são aproveitados na indústria do aço e correspondem a um relevante bem mineral de exportação. Contudo, a maioria desses minerais não foram estudados de maneira detalhada e são de difícil caracterização devido às suas propriedades cristaloquímicas. Mundialmente, a principal fonte do Mn está associada à gonditos, que são rochas manganesíferas metamorfisadas e alteradas intempericamente, originadas a partir de um protólito sedimentar químico, com bandamento spessartina-quartzo. Após a alteração forma depósitos ricos em óxidos-hidróxidos de Mn. O gondito estudado aflora entre os municípios de Nazareno e Coronel Xavier Chaves e está associado a sequência metavulcanossedimentar Rio das Mortes. Os objetivos desse trabalho consistiram: (i) caracterizar os minerais de minério do gondito por difração de raios X (DRX) e por mineralogia automatizada (Zeiss Mineralogic) em MEV-EDS; (ii) e quantificar as fases presentes. A amostra estudada foi moída e classificada granulometricamente em 10 frações abaixo de 500 μm e em uma amostra cabeça, sendo que 3 g de cada fração e da amostra cabeça foram cominuidas em moinho Mccrone (< 10 μm) para análise por DRX com tubo de CuKα. Para análise em MEV-EDS e por Mineralogic, foram produzidas seções polidas recobertas por carbono de 9 frações entre 500-20 μm. Os difratogramas apresentaram baixa razão sinal-ruído, devido à fluorescência do Mn sob radiação de CuKα, prejudicando a quantificação. As frações geradas não apresentaram seletividade significativa entre as fases majoritárias, que, em média, são todorokita (65%) e criptomelana (20%), além de pirolusita, litioforita, hollandita e minerais traço. A conciliação química da quantificação por DRX diverge parcialmente do resultado químico, devido à estrutura dos tectomanganatos (cadeias octaédricas) possuírem vacâncias, que podem ser ocupadas por K+, Na+, Ca2+, Ba2+ (Post et al., 2020). Além disso, o Mn dos tectomanganatos pode ser substituído por outros íons como Al3+ e Fe3+, o que torna a composição dos minerais de minério muito variável, possibilitando a formação de soluções sólidas como todorokita-criptomelana e hollandita-criptomelana, com variável proporção de K, Ba, Ca e Mg. Sugere-se que todorokita é o principal mineral carreador de Mn do gondito, concentrando ~55% do Mn total, bem como seria responsável pela presença de quantidades significativas das impurezas da amostra, sendo 60% do Fe, 45% do Al, 31% do K, 8% do Si e 1% do Ba. Criptomelana, pirolusita e litioforita também são fases que carreiam quantidades significativas de Mn (> 5%). Destaca-se que não foram observados minerais essencialmente de Al e P, que correspondem a elementos críticos ao processamento siderúrgico do minério. Conclui-se que a mineralogia automatizada se mostrou eficiente em superar as limitações analíticas que rochas desta natureza oferecem a quantificação por DRX, além da detecção de minerais em teores menores e variação composicional dos minerais de minério."
FCC - Museu Nacional - Biblioteca Bloco: Andar: Auditório;25 Sep / QUI;13:30 às 15:30h;2219;QUÍMICA MINERAL DE GRANADA DE NÍVEIS MANGANESÍFEROS (GONDITOS) DA SEQUÊNCIA METAVULCANOSSEDIMENTAR RIO DAS MORTES E CORRELAÇÃO COM DIAGRAMAS DE PROVENIÊNCIA SEDIMENTAR AUTORES E ORIENTADORES: CIRO ALEXANDRE ÁVILA,FELIPE EMERSON ANDRÉ ALVES,MARIANA BARCELLOS DA SILVA,MATHEUS LAMAS MACHADO,REINER NEUMANN TRABALHO: 3264 TITULO: Caracterização mineralógica e química da ilmenita presente em saprólitos de pegmatitos da Província Pegmatítica de São João del Rei, Minas Gerais;"CIRO ALEXANDRE ÁVILA; EDUARDO DIAS";FABIANO RICHARD LEITE FAULSTICH;"A granada (A B Si O ) ocorre em rochas ígneas, metamórficas e sedimentares e é utilizada para estudos de proveniência sedimentar por ser (i) comum na 3 2 3 12 assembleia de minerais pesados e (ii) por apresentar grande variação composicional. Seus representantes apresentam solução sólida (troca de elementos nos sítios A e B) e foram designados de piropo (Mg-Al), almandina (Fe-Al), spessartina (Mn-Al), grossulária (Ca-Al), andradita (Ca-Fe) e uvarovita (Ca-Cr). Cada tipo de composição química da granada está associado a um ou mais tipos litológicos específicos (Krippner et al., 2014). Nesse contexto, Morton et al. (2002) propuseram um diagrama triangular para apontar a proveniência da granada presente em rochas sedimentares, porém não incluíram análises de grãos associados a gonditos. Posteriormente, Costa & Remus (2016) propuseram um outro diagrama com um campo para a granada de gonditos, que se sobrepõe com o campo da granada de granitos-pegmatitos. O objetivo deste trabalho é (i) obter a composição química por MEV-EDS da granada presente em gonditos das minas das empresas Monte Azul (amostras 2 e 3) e EMFX (amostras 5 e 6), que fazem parte da sequência metavulcanossedimentar Rio das Mortes e (ii) inserir os membros finais do grupo da granada analisada por MEV-EDS nos diagramas de proveniência sedimentar no intuito de aprimorar o campo específico para a granada proveniente de gonditos. Os gonditos estudados exibem (i) bandamento composicional com camadas ora ricas em quartzo, ora em granada, ora em óxidos-hidróxidos de Mn (amostra 5) e ora em muscovita (amostra 3), implicando na variação composicional do protólito sedimentar. Estudos por difração de raios X apontaram que o gondito é composto principalmente por spessartina, quartzo e minerais secundários de Mn (litioforita, pirolusita e criptomelana). Goethita com Mn e caulinita derivam, possivelmente, da alteração intempérica da granada. Os membros finais da granada dos gonditos correspondem principalmente a spessartina e almandina, que exibem menores proporções de grossulária (5-30%) e piropo (2-5%). No diagrama de Morton et al. (2002) a granada analisada cai nos campos Bi (granitos e pegmatitos) e Bii (rochas metassedimentares de baixo a médio grau) apontando para a dificuldade de separação entre esses dois tipos, enquanto no diagrama de Costa & Remus (2016) os resultados ultrapassam o limite inferior do campo para granada de granitos, pegmatitos e gonditos. A partir da utilização desses diagramas pode-se apontar: (i) granada nas amostras 2 e 6 seria relativamente mais enriquecida na molécula de Mn; (ii) na amostra 5 em Fe; e (ii) na amostra 3 em Ca. Essa variação composicional da granada estaria associada a presença de impurezas na composição do protólito. Análises de granada de gonditos de outras localidades no mundo por microssonda eletrônica também plotam fora do campo sugerido por Costa & Remus (2016) possibilitando a ampliação ou sugestão de um novo campo para granada de gonditos."
FCC - Museu Nacional - Biblioteca Bloco: Andar: Auditório;25 Sep / QUI;13:30 às 15:30h;3845;PRIMEIRA DESCRIÇÃO DE VANADATOS DE BISMUTO (BIVO4) EM PEGMATITOS DA PROVÍNCIA PEGMATÍTICA DE SÃO JOÃO DEL REI, CINTURÃO MINEIRO;"CIRO ALEXANDRE ÁVILA; MARIANA DE MELLO VIDAL";REINER NEUMANN;"Minerais de bismuto não são comuns em pegmatitos, principalmente vanadatos, encontrados sob a forma de três polimorfos de BiVO4: pucherita (ortorrômbico), dreyerita (tetragonal) e clinobisvanita (monoclínico). Segundo Neves & Atêncio (2017), no Brasil foi descrita somente pucherita e essa está associada aos pegmatitos Mario Pinto e Posse, ambos na Província Pegmatítica Oriental Brasileira. Na Província Pegmatítica de São João del Rei foi descrita bismutita Bi2O2(CO3) em pegmatitos intrusivos no ortognaisse Resende Costa (Cidade et al., 2020), apontando para a presença de Bi nessa região. Essa província está inserida no contexto evolutivo do Cinturão Mineiro e é marcada por corpos mineralizados em Sn-Nb-Ta, que são intrusivos em diferentes litótipos da sequência metavulcanossedimentar Rio das Mortes, bem como em ortognaisses e metagranitoides paleoproterozoicos. O presente trabalho visa à descrição em estereomicroscópio do primeiro vanadato de bismuto (BiVO4) presente em material saprolítico do pegmatito Congo Fino, que faz parte da referida província e é intrusivo em filitos e gonditos paraderivados da sequência metavulcanossedimentar Rio das Mortes. Nessa província destaca-se o pegmatito da Volta Grande, que é o único mineralizado em Li e explorado em rocha fresca, enquanto os demais corpos estão intensamente saprolitizados. A metodologia utilizada consistiu na amostragem de 20-25 kg de saprólito do pegmatito, seguido do processamento em leito ativo (peneiramento, deslamagem e concentração em bateia) para a obtenção do concentrado de minerais pesados. No laboratório, o concentrado foi processado em: (i) ultrassom para limpeza e retirada de fases friáveis; (ii) bromofórmio (D = 2,89 g/cm3) para separação dos minerais leves e densos; (iii) ímã de ferrite para a retirada de pirrotita e magnetita; e (iv) separador isodinâmico Frantz nas frações 0,3A, 0,5A, 0,6A, 0,8A, 1,0A, máxima e não atraível. A análise das frações 0,3A e 0,5A, em estereomicroscópio, revelou a presença de aglomerados de cristais submilimétricos com aspecto “botrioidal”, brilho terroso à subvítreo e coloração desde amarelo-claro até amarelo-alaranjado. No microscópio eletrônico de varredura (MEV) os grãos quando alterados apresentam aspecto poroso, são cheios de cavidades e exibem feições de dissolução com a formação de acículas submilimétricas entrelaçadas, enquanto as porções preservadas da alteração são uniformes, homogêneas e exibem sutil zonamento oscilatório. Preliminarmente, os grãos analisados são compostos de Bi (65,6 a 68,7%), V (18,2 a 19,7%) e O, enquanto Ca (0,19 a 0,48%), Fe (0,26 a 0,52%) e Pb (0,93 a 2,97%) são elementos traço. Correspondem a um polimorfo de BiVO4 (pucherita, dreyerita ou clinobisvanita). Foi identificada associada uma inclusão mais rica em Bi (87%), provavelmente um sulfeto de Bi ou Bi nativo. Conclui-se que o vanadato de bismuto identificado é atraído nas frações 0,3A e 0,5A e corresponde à terceira ocorrência brasileira associada a pegmatitos."
FCC - Museu Nacional - Biblioteca Bloco: Andar: Auditório;25 Sep / QUI;13:30 às 15:30h;4001;Aspectos mineralógicos e composição química da monazita presente em saprólitos de pegmatitos da Província Pegmatítica de São João del Rei, Cinturão Mineiro, Minas Gerais;CIRO ALEXANDRE ÁVILA;GABRIELA DE OLIVEIRA VELOSO;"O grupo da monazita envolve a solução sólida entre monazita [2ETR(PO₄)], huttonita [2Th(SiO₄)] e cheralita [CaTh(PO₄)₂], sendo que a monazita pode ser classificada de acordo com o predomínio do elemento terras raras (ETR): monazita-(La), monazita-(Ce), monazita-(Sm) e monazita-(Nd) (Linthout, 2007). Esse mineral é observado em granitoides, gnaisses, anfibolitos e pegmatitos, sendo utilizado em estudos mineralógicos, petrológicos e geocronológicos. No contexto geológico do Cinturão Mineiro, destaca-se a Província Pegmatítica de São João del Rei, que envolve um enxame de pegmatitos mineralizados em minerais de Nb-Ta-Sn (Pereira et al., 2004). Esses pegmatitos estão fortemente alterados intempericamente, favorecendo o estudo dos minerais pesados presente no material saprolítico. O objetivo deste trabalho é descrever as características mineralógicas dos grãos de monazita dos pegmatitos em estereomicroscópio e por microscopia eletrônica de varredura (MEV), além de determinar a composição química por espectroscopia de energia dispersiva (EDS), estabelecendo qual ETR predomina. O material saprolítico dos pegmatitos foi amostrado entre 20-25 kg, peneirado a 2 mm para desagregação e retirada de grãos maiores-fragmentos, lavado em leito ativo para remoção dos argilominerais e concentrado em bateia para obtenção do concentrado de minerais pesados. No laboratório, os concentrados foram processados em: (i) ultrassom para eliminação dos argilominerais e retirada do cimento presente entre ou ao redor dos grãos, que correspondem a hidróxidos-óxidos de Fe-Mn-Al; (ii) bromofórmio (d=2,89 g/cm³) para a separação dos minerais leves (quartzo e feldspato) dos pesados; (iii) ímã de mão para remoção de fases ferromagnéticas (magnetita e pirrotita); (iv) separador magnético isodinâmico Frantz, em diferentes correntes (0,3 - 0,5 - 0,6 - 0,8 - 1,0 - 1,5 A), para facilitar a identificação dos minerais em estereomicroscopia. A monazita é abundante nas frações 0,6 e 0,8 A e, em estereomicroscópio, varia de submilimétrica a 2 mm. Não foi observada clivagem, ocorre em grãos tabulares alongados e achatados e, mais raramente, em cristais prismáticos, normalmente com terminação de um dos vértices. Sua cor e brilho variam amplamente: laranja-amarronzada, que exibe brilho vítreo a resinoso e está mais preservada da alteração intempérica; esverdeada, que possui brilho resinoso e encontra-se moderadamente alterada; amarela-esbranquiçada, que apresenta brilho graxo e está fortemente alterada. No MEV, a monazita raramente está zonada e, geralmente, encontra-se repleta de cavidades (raros cristais estão límpidos), associadas à remoção de minerais alterados. Exibe inclusões de apatita, zircão, microlita, galena e prováveis exsoluções de uraninita, thorita e xenotímio. Os grãos de monazita apresentam, por EDS, o predomínio de ETR leves e intermediárias (Ce-Nd-Sm-La). ThO₂ e os ETR pesados também estão presentes, porém em menor quantidade. U, Pb, Si, Y e Ca ocorrem em proporções menores."
