Local;Data;Horário;ID do Trabalho;Título;Autor(es);Orientador(es);Resumo
FCC/Salão Nobre Bloco: Andar: 1;23 Sep / TER;13:30 às 15:30h;165;Montagens de Harold Pinter;"ADRIANA SCHNEIDER ALCURE; JACYAN CASTILHO; JOSé HENRIQUE FERREIRA BARBOSA MOREIRA";MISAEL EDILSON OLIVEIRA DA COSTA 2;"As peças “O Monta Cargas” (Mostra Mais 2024), e “A Estufa” (Mostra de Teatro XXIV da UFRJ), do dramaturgo inglês Harold Pinter, foram montadas durante o ano de 2024, sendo estreadas no primeiro e segundo semestre do mesmo ano. Ambas montagens contaram com elenco totalmente feminino, onde as atrizes interpretaram personagens masculinos. O processo de montagem, em ambos processos, se iniciou com a leitura do texto para que fosse compartilhada a visão dos envolvidos sobre o que entenderam e sentiam sobre a história. Posteriormente seguimos para a construção de personagens e a criação corporal. Após um mês de criação, iniciamos o processo de marcação de cena, onde ficamos cerca de um mês. Nas semanas anteriores à estreia realizamos ajustes nas marcações, movimentações, figurino e no cenário. Por estarem interpretando homens, a equipe de preparação vocal optou por trabalhar na alteração do registro vocal das atrizes, para que elas pudessem atingir tons masculinos de forma que não prejudicasse a saúde delas. “O Monta Cargas” contou com duas atrizes, já “A Estufa” contou em seu elenco quatro atrizes. O número de membros na equipe também subiu de 16 para 25 na segunda peça. A parte estética também foi um grande diferencial entre elas. “A Estufa” foi altamente inspirada no artista Bob Wilson e na sua arte surrealista. E isso influenciou na criação dos figurinos, cenário e na caracterização das atrizes. Com o empenho, disponibilidade e organização conseguimos concluir de forma bastante satisfatória as duas montagens realizando totalmente ou quase totalmente as concepções idealizadas durante o período de criação da peça. A “Mostra Mais” é uma atividade gratuita, que conjuga ensino, pesquisa e extensão, realizada anualmente ao fim do 1º semestre letivo na Escola de Comunicação e reúne cerca de 1.200 espectadores(as). Trata-se de um evento já consagrado na escola, no campus, na universidade e na cidade, realizado desde 2005. As ""Mostras de Teatro da UFRJ” são aventos anuais de apresentação dos experimentos teatrais elaborados ao longo da disciplina ""Projeto Experimental em Teatro"" (espetáculo de formatura), do curso de Direção Teatral da Escola de Comunicação da UFRJ. É um evento de ensino, pesquisa e extensão que conta com a participação de docentes e discentes de variados cursos e também membros externos à UFRJ nas equipes das peças. Faz parte do Projeto Artístico de Representação Institucional (PARIN) “Mostras do curso de Direção Teatral” e do Circuito PROART (Programa de Apoio às Artes do Fórum de Ciência e Cultura)."
FCC - FLAMENGO Bloco: Prédio do CBAE/FCC Andar: SALA 1;23 Sep / TER;13:30 às 15:30h;166;AS MOSTRAS DE TEATRO DA UFRJ E A PRODUÇÃO CULTURAL;"ADRIANA SCHNEIDER ALCURE; HEMYLLY CASTELANO DA COSTA; MARCELUS GONCALVES FERREIRA";MARIANA PEREIRA COSTA SANTOS;A cada final de semestre, a Sala Vianninha se transforma em um palco para celebrar a vida do teatro universitário. Com mais de 20 anos de existência, as “Mostras do Curso de Direção Teatral” acontecem em dois momentos: ao fim da primeira metade do ano como “Mostra Mais”, para a montagem das produções da disciplina Direção IV — como uma atividade pré-formatura —, e no final do ano como “Mostra de Teatro da UFRJ”, quando os alunos apresentam seus projetos de formatura. Mais que atividades meramente disciplinares, as Mostras são projetos chaves em um dos pilares da educação pública: a integração com a sociedade, recebendo o público externo como espectador dos futuros talentos do teatro brasileiro. Classificadas como PARIN (Projeto Artístico de Representação Institucional) pelo PROART (Programa de Apoio às Artes) do Fórum de Ciência e Cultura da UFRJ, os eventos também são intercâmbios entre alunos de diferentes cursos de graduação. Esses discentes são incorporados nas mais diversas funções necessárias para o andamento dos espetáculos. Nessa fusão, fomos bolsistas PROART durante ambas as Mostras do ano de 2024, como produtoras dos eventos pelo segundo ano. Nossas atribuições começavam na pré-produção e seguiam até as luzes da coxia se apagarem. Começando com a divulgação da Mostra, desde a colocação de banners até às postagens nas diversas redes sociais do evento, chegando até o dia a dia das peças, em contato com os com os(as) alunos(as)-diretores(as) e membros das equipes, com os(as) docentes orientadores(as), com a equipe técnica e com o público, dando suporte à formação dos(as) discentes da Direção Teatral e ao pleno funcionamento do evento. Outras atribuições diárias eram: prestar suporte à equipe SUAT (Sistema Universitário de Apoio Teatral), também um PARIN/PROART, feitura das senhas distribuídas para organização e controle do público, manejar os espectadores antes e durante a entrada na sala Vianninha, bem como preenchimento de planilhas enumerando o horário inicial e final das peças, a fim de estipular se o tempo total foi de acordo com o tempo determinado pelas orientações do corpo discente. Por fim, o resultado obtido é, principalmente, o aprendizado. O contato direto com o teatro — que nos é uma arte pouco acessível— nos aproximou de uma outra perspectiva: como futuras jornalistas e como pessoas em formação. Além de nos oferecer uma maior dimensão na importância das bolsas acadêmicas como projeto de permanência universitária, o nosso último ano de imersão na Mostra de Teatro da UFRJ como bolsistas, nos proporcionou um mergulho no entender do que é a produção e divulgação de cultura, através dos mecanismos da Universidade Pública, de modo que nos marcou para uma vida.
FCC - FLAMENGO Bloco: Prédio do CBAE/FCC Andar: SALA 1;23 Sep / TER;13:30 às 15:30h;169;Apoio à produção no Seminário de Pesquisas do Curso de Direção Teatral;"ADRIANA SCHNEIDER ALCURE; GABRIELA LIRIO GURGEL MONTEIRO";ISABELLA CáSSIA RIBEIRO GONçALVES ANDRADE;Participei como bolsista PROART, como assistente da professora Gabriela Lirio, organizadora do Seminário de Pesquisas do Curso de Direção Teatral. Minha participação foi restrita ao evento, que teve como foco a apresentação de pesquisas acadêmicas desenvolvidas por estudantes do Curso de Direção Teatral, promovendo a troca entre orientadores e orientandos/as. Atuei na equipe de produção e apoio logístico, auxiliando docentes e discentes na estruturação das mesas de apresentação, organização do coffee break, impressão dos resumos dos trabalhos e, ao final do evento, na desmontagem e entrega da sala organizada ao Fórum de Ciência e Cultura. A atividade, embora concentrada em um único dia, foi fundamental para vivenciar os bastidores de um evento acadêmico e entender a importância do suporte técnico e organizacional para o bom andamento das atividades de extensão. Na pré-produção, providenciei biscoitos, café, o galão de água (emprestado da Escola de Comunicação, precisou ser instalado no salão do Fórum, onde ocorreu o evento), arrumei a sala (as cadeiras dos espectadores, dos palestrantes, bem como o acompanhamento da instalação dos equipamentos pela equipe técnica do Fórum). Na produção, cuidei para que tudo ocorresse da melhor forma, repondo a mesa de café, colaborando com a Profa. Gabriela Lirio na organização das mesas, na contagem dos tempos de fala e no recebimento de docentes e público em geral. Na pós-produção, guardamos todos os materiais, devolvemos o galão de água e nos certificamos de que a sala estava organizada e todos os equipamentos desligados. A experiência me aproximou do universo das pesquisas do Curso de Direção Teatral, uma vez que pude acompanhar todas as falas, dos orientadores e orientandos, ampliando minha compreensão sobre os processos artístico-acadêmicos desenvolvidos no curso. O público compreendeu uma média de 50 pessoas no total, entre estudantes e docentes dos cursos de Direção Teatral, do Programa de Pós-Graduação em Artes da Cena (estudantes de pós foram mediadores das mesas) e do Curso de Fonoaudiologia.
FCC - FLAMENGO Bloco: Prédio do CBAE/FCC Andar: SALA 1;23 Sep / TER;13:30 às 15:30h;181;Frutos de uma produção;"ADRIANA SCHNEIDER ALCURE; DIONATHA WILLIAN DOS SANTOS MESQUITA";ÉRIKA DE SOUZA VARGAS DE OLIVEIRA;De 17 a 20 de outubro de 2024 ocorreu o evento “Viva! 30+10: celebração dos 30 anos do curso de Direção Teatral e 10 anos do Programa de Pós- Graduação em Artes da Cena”. O projeto aconteceu no Teatro Cacilda Becker, equipamento cultural da FUNARTE. A pauta no teatro foi conseguida a partir de concorrência por edital público. O objetivo do Viva! foi celebrar essa grande conquista e resistência que são os 30 anos do curso de Bacharelado em Artes Cênicas – Direção Teatral (DT) e os 10 anos do PPGAC, ambos da Universidade Federal do Rio de Janeiro. A fim de integrar e partilhar com a sociedade a produção feita na universidade, a programação do Viva! foi composta de espetáculos, palestras-performances, lançamentos de livros, partilhas de pesquisa e rodas de conversa. Todas as atividades apresentadas foram realizadas por estudantes da graduação de da pós-graduação em diálogo e orientação de docentes. Para a realização do evento foi necessária a colaboração de diversas pessoas, tanto da graduação quanto da pós- graduação. Professores, estudantes, bolsistas, alunos formados, equipe do Teatro Cacilda Becker, entre outros. Nesse contexto, o presente trabalho terá como objetivo partilhar a experiência dos bolsistas do curso de Direção Teatral na produção do evento Viva!. Na metodologia, foram realizadas reuniões virtuais com a finalidade de organização das demandas do projeto. Algumas das demandas do primeiro encontro, que aconteceu no dia 02 de setembro de 2024, foram, por exemplo: liberação de direitos autorais – tanto de músicas quanto de peças teatrais, organização da programação, escolha do nome do evento, organização referente ao funcionamento do teatro Cacilda Becker. No segundo encontro, feito no dia 03 de outubro de 2024, as funções foram divididas entre as pessoas da produção do evento, ficando os bolsistas da DT responsáveis pela logística, ou seja, estarem nos quatro dias de evento para resolver demandas (por exemplo, arrumação do espaço), acompanhar e organizar as vendas dos livros, ir ao entorno do teatro pedir apoio cultural, organizar estudantes para transporte dos cenários das peças, compra e organização do coquetel de abertura, etc. Assim, conseguimos concluir todas as demandas que apareceram e garantimos um evento agradável tanto para o público quanto para os participantes. Em vista do exposto, nota-se que a produção feita pelos bolsistas de DT foi essencial para o êxito do evento Viva! 30+10, consolidando assim a integração das ações realizadas no âmbito universitário à sociedade carioca – além de lembrarmos que a arte na universidade pública existe, persiste e continuará dando frutos culturais que alimentam toda a população.
FCC - FLAMENGO Bloco: Prédio do CBAE/FCC Andar: SALA 1;23 Sep / TER;13:30 às 15:30h;4681;ENTRE LUZES E DANÇAS: O INTERCÂMBIO DE SABERES PELA SUAT UFRJ;"CAROLINA MAIA; ISABELLE OLIVEIRA DA SILVA; JOSé HENRIQUE FERREIRA BARBOSA MOREIRA";VANESSA DA SILVA XAVIER;"Este trabalho tem como objetivo relatar experiências interdisciplinares no âmbito do programa PROART, vinculadas ao Projeto Artístico de Representação Institucional (PARIN) intitulado Sistema Universitário de Apoio Teatral (SUAT), que viabilizaram desenvolver e aprofundar conhecimentos técnicos e científicos no campo das artes e da produção cultural. O Centro Coreográfico da Tijuca foi o principal campo de pesquisa do SUAT durante o evento ""Tramas e Teias"". A programação reuniu artistas independentes de diversas regiões, que apresentaram suas expressões culturais por meio da dança — entre elas, o Breaking, numa competição amistosa à qual damos o nome de batalhas. O evento reuniu um grupo diverso, tanto de fora quanto de dentro da faculdade, incluindo docentes e discentes predominantemente dos cursos de Dança. O SUAT teve como objetivo central registrar e valorizar o Hip Hop tanto como manifestação cultural quanto como linguagem artística, com ênfase na dança Breaking. Para isso, utilizamos como referência gravações de grandes eventos internacionais da modalidade, geralmente transmitidos ao vivo. Embora a proposta inicial fosse realizar a transmissão do evento, a falta de conexão com a internet no local nos levou a buscar alternativas. Assim, desenvolvemos e aplicamos técnicas de gravação e edição capazes de transmitir ao público a sensação de estar presente, vivenciando intensamente cada detalhe, emoção e vibração como se estivesse assistindo ao evento ao vivo. O resultado foram vídeos com transições e recursos visuais tão dinâmicos e fluidos quanto o próprio Breaking, refletindo em cada elemento a estética marcante da Cultura Hip Hop. Nossa equipe também atuou nos bastidores técnicos do evento, contribuindo diretamente com a montagem de cenários, estrutura de arquibancadas, iluminação e outros aspectos essenciais da produção. Essa vivência nos proporcionou uma compreensão mais ampla de como os elementos interdisciplinares se articulam na prática, desenvolvendo habilidades que se refletem em nossas trajetórias acadêmicas, profissionais e pessoais. Aprendemos a trabalhar em equipe, a lidar com prazos apertados e recursos limitados, e a sermos flexíveis, adaptáveis e criativos na resolução de problemas."
FCC - FLAMENGO Bloco: Prédio do CBAE/FCC Andar: SALA 1;23 Sep / TER;13:30 às 15:30h;6469;O SUAT na produção técnica e difusão da Ópera na UFRJ;"ILEANA THAIS; JOSé HENRIQUE FERREIRA BARBOSA MOREIRA; MARIA EDUARDA ANDRADE DE MENDONCA BRUM";MICAELA COSTA DA LUZ;Desde 2011, o Sistema Universitário de Apoio Teatral (SUAT), que atua na produção técnica de espetáculos e eventos acadêmicos, vem colaborando com a produção e os registros do “Ópera na UFRJ’. Criado em 1994 como projeto da Escola de Música da UFRJ, a ópera é um dos maiores produtos culturais da instituição, envolvendo docentes, servidores, estudantes e equipes de diversas unidades acadêmicas, inclusive o SUAT, que colabora com a criação, montagem e operação de iluminação cênica e, desde 2022, na transmissão ao vivo das récitas. Chamada por Richard Wagner de “a arte que une todas as outras”, a Ópera repercute essa integração também no trabalho do SUAT. No apoio à ópera, a equipe reúne bolsistas de áreas como Radialismo, Direção Teatral, Engenharia Eletrônica, Arquitetura e Música, promovendo um ambiente de aprendizado e troca de experiências entre múltiplos saberes. No biênio 2024–2025, a produção lírica da Escola de Música incluiu duas obras: “Il Nèo”, de Henrique Oswald, e “As Bodas de Fígaro”, de W. A. Mozart. Na primeira, realizada em junho e julho de 2024, a equipe do SUAT enfrentou o desafio especial de um espetáculo acontecendo em todo o prédio da Escola de Música, exigindo iluminação em áreas não convencionais do edifício, fora da sala de espetáculos, e registro em vídeo com câmera móvel e sob condições complexas. Para “Bodas de Fígaro”, com temporada marcada para junho e julho de 2025, o SUAT terá sob responsabilidade a iluminação e transmissão de uma obra consagrada do repertório internacional com dezenas de montagens publicadas na internet ou em DVD, o que permite, por um lado, estudar a obra com mais antecedência, mas não evita a expectativa pela comparação com esses outros registros, muitos dos quais profissionais e com grandes recursos. Ambas as montagens da Escola de Música incluíram ou incluirão récitas fora do Rio de Janeiro, exigindo deslocamento de equipe do SUAT a outros municípios.
FCC - Museu Nacional - Biblioteca Bloco: Andar: Auditório;23 Sep / TER;13:30 às 15:30h;106;UMA ESPÉCIE NOVA DE CAVICHIANA PROVENIENTE DO ESTADO DO ESPÍRITO SANTO (INSECTA: HEMIPTERA: CICADELLIDAE: CICADELLINI);"ÁGATHA TIMÓTEO DE OLIVEIRA; ANDRÉ ALMEIDA ALVES; GABRIEL MEJDALANI";VICTOR MARCOS CORDEIRO QUINTAS;"Os Cicadellidae (cigarrinhas) são insetos fitófagos e saltadores. Essa família, a mais diversa de Hemiptera, possui mais de 22.000 espécies conhecidas e está distribuída em todas as regiões zoogeográficas. A subfamília Cicadellinae inclui, aproximadamente, 2.400 espécies distribuídas em 330 gêneros e duas tribos, Cicadellini e Proconiini. Os membros dessa subfamília alimentam-se somente no xilema de suas plantas hospedeiras. Este trabalho aborda uma espécie nova de Cavichiana Mejdalani et al., 2014 procedente do Parque Nacional do Caparaó, Ibitirama, Espírito Santo. Esse gênero possui três espécies descritas e se distribui do Sudeste ao Sul do Brasil (Mata Atlântica), tendo somente bromélias (Bromeliaceae) como plantas hospedeiras. Cavichiana pode ser diagnosticado pelo seguinte conjunto de características: 1) cabeça deltoide e fortemente pronunciada anteriormente; 2) ocelos localizados anteriormente aos ângulos anteriores dos olhos; 3) edeago (órgão copulador masculino) simétrico, podendo apresentar coroa apical de espinhos (C. bromelicola Mejdalani et al., 2014), lobo basidorsal (C. alpina Quintas et al., 2020) ou projeção posterior (C. caelivittata Mejdalani et al., 2023); 4) paráfise com haste e ramos alongados, os últimos com uma projeção basidorsal. A cor vermelha dos olhos possivelmente é outra característica diagnóstica do gênero. Foram estudados 22 espécimes da espécie nova (17 machos e 5 fêmeas), depositados na coleção científica do Departamento de Entomologia, Museu Nacional, UFRJ (MNRJ). As estruturas das terminálias masculina e feminina foram preparadas em KOH 10% e dissecadas. Foram elaboradas fotografias e ilustrações das partes externas do corpo e das estruturas genitais. Os exemplares da série-tipo foram coligidos em bromélias. A espécie nova apresenta a seguinte combinação de características: 1) dorso castanho-escuro a preto; cabeça com pequenas manchas azuladas; asas anteriores com uma grande mancha circular transcomissural azul-clara, cuja parte anterior recobre o escutelo; 2) pigóforo masculino com a margem posterior amplamente arredondada; 3) estilos com a porção distal, após o lobo pré-apical, moderadamente alongada e com o ápice truncado; 4) edeago com conspícua projeção posterior dirigida dorsalmente, sem coroa apical de espinhos ou lobo basidorsal; 5) paráfise com o processo basal dos ramos espiniforme e bem desenvolvido; 6) esternito VII feminino com a margem posterior levemente côncava. Trata-se do primeiro registro de Cavichiana no Espírito Santo, constituindo o limite norte conhecido da distribuição do gênero. Considerando-se o padrão de coloração, a espécie nova compartilha várias semelhanças com C. bromelicola. Todavia, a grande mancha das asas anteriores é inteiramente azulada no novo táxon (principalmente amarela em C. bromelicola) e o edeago possui uma grande projeção posterior dirigida dorsalmente (sem tal projeção e com uma coroa apical de espinhos em C. bromelicola)."
FCC - Museu Nacional - Biblioteca Bloco: Andar: Auditório;23 Sep / TER;13:30 às 15:30h;745;Microtomografia aplicada à reconstrução do membro peitoral de Brasilodon quadrangularis (Synapsida: Cynodontia) do Triássico Superior do Brasil;"JOÃO FELIPE LEAL KAIUCA; MARINA BENTO SOARES";VICTORIA ROSA DA SILVA LEITE;"Estimar a anatomia muscular de espécies extintas contribui para o entendimento de sua locomoção, comportamento e ecologia. Para tal, é necessário investigar aspectos da anatomia óssea preservada associados a pontos de origem e inserção de músculos. Brasilodon quadrangularis é um cinodonte não- mamaliaforme do Triássico Superior do Brasil (~225 milhões de anos), consensualmente considerado táxon irmão de Mammaliaformes (Bonaparte et al., 2003), grupo que inclui os mamíferos viventes. Reconstruir a anatomia muscular de Brasilodon deve jogar luz em aspectos dos hábitos locomotores, comportamentais e da ecologia nesse momento crucial da origem dos mamíferos. O espécime UFRGS-PV-1043-T, um indivíduo adulto de Brasilodon, relativamente completo e em bom estado de preservação, foi submetido ao microtomógrafo Skyscan™ 1173, permitindo acessar novas informações de materiais inseridos na matriz rochosa. A segmentação dos tomogramas foi feita no programa Dragonfly 2022.2. Neste estudo em andamento, esses dados estão sendo utilizados para estimar os pontos de origem e inserção da musculatura do membro anterior de Brasilodon. Para tal, utilizou-se como base a lista de 73 caracteres de Bishop & Pierce (2024), que focam em tendências evolutivas musculares ao longo da linhagem Synapsida, incluindo UFRGS- PV-1043-T na amostra analisada. Nossos resultados preliminares corroboram as interpretações de Bishop & Pierce (2024) baseadas nos caracteres já polarizados a partir dos ossos expostos fora da matriz rochosa, indicando que a microtomografia gerou resultados equivalentes à observação do material original. Com a visualização de tomogramas de partes da ulna obstruídas pela matriz rochosa, foi possível observar o estado de nove caracteres pela primeira vez, entre eles: (1) no caráter 36 foi interpretado o estado 1, indicando que a inserção do músculo brachialis ocorre na face medial da diáfise proximal da ulna; (2) no caráter 56 foi verificado o estado 2, indicando que a inserção do músculo epitrochleoanconaeus ocorre na face posterior do processo olécrano da ulna; (3) no caráter 69 foi verificado o estado 1, indicando que a inserção do músculo anconaeus ocorre na face anterior da região proximal da ulna, incluindo grande parte do olécrano. A maioria dos estados corresponde ao que seria esperado por estimativa de caracteres ancestrais por verossimilhança (Bishop & Pierce, 2024). O caráter 33 foi a única exceção, verificamos o estado 0 devido à ausência da cicatriz longitudinal que caracteriza o estado 1. Essas novas informações indicam a posição de músculos importantes para a flexão, extensão e estabilidade na articulação do cotovelo, porém uma análise mais detalhada de sua funcionalidade depende do estudo, ainda em andamento, de outros elementos ósseos do membro anterior de Brasilodon. Do ponto de vista evolutivo, esses caracteres contribuem para o entendimento da progressiva especialização muscular dos membros anteriores, ao longo da evolução dos mamíferos."
